{
  "schema_version": 2,
  "dataset": "history",
  "as_of": "2026-08-18",
  "sources": [
    {
      "source_id": "egov-laws",
      "name": "e-Gov法令検索",
      "authority": "デジタル庁",
      "base_url": "https://laws.e-gov.go.jp/",
      "entry_urls": [
        "https://laws.e-gov.go.jp/api/2/law_data/363AC0000000108",
        "https://laws.e-gov.go.jp/api/2/law_data/325AC0000000226"
      ],
      "source_type": "law_api",
      "scope": "現行法令本文、法令ID、改正履歴",
      "jurisdiction": "Japan",
      "priority": 1,
      "cadence": "daily",
      "enabled": true,
      "automation_enabled": true,
      "adapter": "egov_law_article_facts",
      "accepted_content_types": [
        "application/json"
      ],
      "extraction": {
        "expected_pages": 2,
        "required_markers": [],
        "expected_documents": [
          {
            "page_index": 0,
            "law_id": "363AC0000000108",
            "law_title": "消費税法"
          },
          {
            "page_index": 1,
            "law_id": "325AC0000000226",
            "law_title": "地方税法"
          }
        ],
        "facts": [
          {
            "fact_id": "consumption-tax-act-standard-rate",
            "page_index": 0,
            "article_num": "29",
            "article_caption": "（税率）",
            "item_num": "1",
            "pattern": "(百分の.+)$",
            "capture_group": 1,
            "transform": "string",
            "expected_value": "百分の七・八"
          },
          {
            "fact_id": "local-tax-act-local-consumption-ratio",
            "page_index": 1,
            "article_num": "72_83",
            "article_caption": "（地方消費税の税率）",
            "pattern": "地方消費税の税率は、([^、。]+)とする",
            "capture_group": 1,
            "transform": "string",
            "expected_value": "七十八分の二十二"
          }
        ]
      },
      "rate_limit": "公式仕様およびrobots.txtに従う",
      "terms_url": "https://laws.e-gov.go.jp/terms/",
      "last_verified_at": "2026-08-16T12:20:19+09:00",
      "notes": "法案審議の早期検知には国会情報を併用する"
    },
    {
      "source_id": "jeed-disability-employment-levy",
      "name": "JEED 障害者雇用納付金制度の概要",
      "authority": "独立行政法人高齢・障害・求職者雇用支援機構",
      "base_url": "https://www.jeed.go.jp/",
      "entry_urls": [
        "https://www.jeed.go.jp/disability/about_levy_grant_system.html"
      ],
      "source_type": "public_agency",
      "scope": "障害者雇用納付金の対象事業主、算定基礎、1人当たり月額",
      "jurisdiction": "Japan",
      "priority": 1,
      "cadence": "monthly",
      "enabled": true,
      "automation_enabled": true,
      "monitoring_tax_ids": [
        "disability-employment-levy"
      ],
      "adapter": "html_regex_facts",
      "accepted_content_types": [
        "text/html"
      ],
      "extraction": {
        "expected_pages": 1,
        "required_markers": [
          {
            "page_index": 0,
            "label": "liable employer scope",
            "pattern": "常時雇用している労働者数が[0-9０-９]+人を超える事業主"
          },
          {
            "page_index": 0,
            "label": "statutory shortfall basis",
            "pattern": "法定雇用障害者数に不足する障害者数に応じて"
          }
        ],
        "facts": [
          {
            "fact_id": "monthly-levy-amount",
            "page_index": 0,
            "pattern": "1人当たり月額([0-9０-９,，]+)円",
            "capture_group": 1,
            "transform": "japanese_number",
            "expected_value": 50000
          }
        ]
      },
      "rate_limit": "サイトの利用条件に従う",
      "terms_url": "https://www.jeed.go.jp/general/terms.html",
      "last_verified_at": "2026-08-21T08:30:00+09:00",
      "notes": "制度概要に明記された現行の納付金額を監視する。適用開始日は概要ページで確認できないため推測せずnullとする"
    },
    {
      "source_id": "kanpo",
      "name": "官報発行サイト",
      "authority": "国立印刷局",
      "base_url": "https://www.kanpo.go.jp/",
      "entry_urls": [
        "https://www.kanpo.go.jp/"
      ],
      "source_type": "official_gazette",
      "scope": "法律、政令、省令等の公布確認",
      "jurisdiction": "Japan",
      "priority": 1,
      "cadence": "publication_days",
      "enabled": true,
      "adapter": "manual",
      "rate_limit": "サイトの利用条件に従う",
      "terms_url": "https://www.kanpo.go.jp/",
      "last_verified_at": "2026-08-16T12:20:19+09:00",
      "notes": ""
    },
    {
      "source_id": "mext-educational-public-transmission-compensation",
      "name": "文部科学省 授業目的公衆送信補償金制度Q&A",
      "authority": "文部科学省",
      "base_url": "https://www.mext.go.jp/",
      "entry_urls": [
        "https://www.mext.go.jp/a_menu/coronavirus/mext_00042.html"
      ],
      "source_type": "ministry",
      "scope": "授業目的公衆送信補償金の支払主体、対象、学校種別の児童生徒等1人当たり認可額",
      "jurisdiction": "Japan",
      "priority": 1,
      "cadence": "annual",
      "enabled": true,
      "automation_enabled": true,
      "monitoring_tax_ids": [
        "educational-public-transmission-compensation"
      ],
      "adapter": "html_regex_facts",
      "accepted_content_types": [
        "text/html"
      ],
      "extraction": {
        "expected_pages": 1,
        "required_markers": [
          {
            "page_index": 0,
            "label": "education provider payment",
            "pattern": "学校の設置者が一括して補償金を支払う"
          },
          {
            "page_index": 0,
            "label": "approved compensation",
            "pattern": "補償金の額は、文化庁長官によって認可"
          },
          {
            "page_index": 0,
            "label": "scope limitation",
            "pattern": "その他の学校種や減免条件、都度支払いの料金体系"
          }
        ],
        "facts": [
          {
            "fact_id": "elementary-school-amount",
            "page_index": 0,
            "pattern": "小学校([0-9０-９,，]+)円",
            "capture_group": 1,
            "transform": "japanese_number",
            "expected_value": 120
          },
          {
            "fact_id": "junior-high-school-amount",
            "page_index": 0,
            "pattern": "中学校([0-9０-９,，]+)円",
            "capture_group": 1,
            "transform": "japanese_number",
            "expected_value": 180
          },
          {
            "fact_id": "high-school-amount",
            "page_index": 0,
            "pattern": "高等学校([0-9０-９,，]+)円",
            "capture_group": 1,
            "transform": "japanese_number",
            "expected_value": 420
          },
          {
            "fact_id": "university-amount",
            "page_index": 0,
            "pattern": "大学([0-9０-９,，]+)円",
            "capture_group": 1,
            "transform": "japanese_number",
            "expected_value": 720
          }
        ]
      },
      "rate_limit": "サイトの利用条件に従う",
      "terms_url": "https://www.mext.go.jp/b_menu/1351168.htm",
      "last_verified_at": "2026-08-21T09:45:00+09:00",
      "notes": "学校種別の例示4値を監視する。その他の学校種、減免、都度払いは規程に依存するため、このsourceの4値へ集約しない。ページにない適用開始日は推測しない"
    },
    {
      "source_id": "mhlw-employment-insurance-rates",
      "name": "厚生労働省 令和8年度雇用保険料率",
      "authority": "厚生労働省",
      "base_url": "https://www.mhlw.go.jp/",
      "entry_urls": [
        "https://www.mhlw.go.jp/content/001692566.pdf"
      ],
      "source_type": "ministry",
      "scope": "雇用保険料率の事業区分別合計、労働者負担、事業主負担、適用期間",
      "jurisdiction": "Japan",
      "priority": 1,
      "cadence": "annual",
      "enabled": true,
      "automation_enabled": true,
      "monitoring_tax_ids": [
        "employment-insurance-premium"
      ],
      "adapter": "pdf_regex_facts",
      "accepted_content_types": [
        "application/pdf"
      ],
      "extraction": {
        "expected_pages": 1,
        "required_markers": [
          {
            "page_index": 0,
            "label": "fiscal application period",
            "pattern": "2026[^0-9]+0?4[^0-9]+0?1[^0-9]+.*2027[^0-9]+0?3[^0-9]+31"
          },
          {
            "page_index": 0,
            "label": "general business rates",
            "pattern": "5/1,0008\\.5/1,0005/1,0003\\.5/1,00013\\.5/1,000"
          },
          {
            "page_index": 0,
            "label": "agriculture rates",
            "pattern": "6/1,0009\\.5/1,0006/1,0003\\.5/1,00015\\.5/1,000"
          },
          {
            "page_index": 0,
            "label": "construction rates",
            "pattern": "6/1,00010\\.5/1,0006/1,0004\\.5/1,00016\\.5/1,000"
          }
        ],
        "facts": [
          {
            "fact_id": "employment-period-start",
            "page_index": 0,
            "pattern": "(2026)[^0-9]+(0?4)[^0-9]+(0?1)",
            "capture_group": 1,
            "transform": "iso_date_components",
            "expected_value": "2026-04-01"
          },
          {
            "fact_id": "employment-period-end",
            "page_index": 0,
            "pattern": "(2027)[^0-9]+(0?3)[^0-9]+(31)",
            "capture_group": 1,
            "transform": "iso_date_components",
            "expected_value": "2027-03-31"
          },
          {
            "fact_id": "employment-general-worker",
            "page_index": 0,
            "pattern": "[^0-9.]([0-9.]+)/1,0008\\.5/1,0005/1,0003\\.5/1,00013\\.5/1,000",
            "capture_group": 1,
            "transform": "number",
            "expected_value": 5
          },
          {
            "fact_id": "employment-general-employer",
            "page_index": 0,
            "pattern": "5/1,000([0-9.]+)/1,0005/1,0003\\.5/1,00013\\.5/1,000",
            "capture_group": 1,
            "transform": "number",
            "expected_value": 8.5
          },
          {
            "fact_id": "employment-general-total",
            "page_index": 0,
            "pattern": "5/1,0008\\.5/1,0005/1,0003\\.5/1,000([0-9.]+)/1,000",
            "capture_group": 1,
            "transform": "number",
            "expected_value": 13.5
          },
          {
            "fact_id": "employment-agriculture-worker",
            "page_index": 0,
            "pattern": "[^0-9.]([0-9.]+)/1,0009\\.5/1,0006/1,0003\\.5/1,00015\\.5/1,000",
            "capture_group": 1,
            "transform": "number",
            "expected_value": 6
          },
          {